### ISSUE TITLE
Loadbalancer service healthcheck for traefik

### ISSUE THREAD

**Issue by nazarkulyk** [hetznercloud/hcloud-cloud-controller-manager#87]
Hi,

i deployed traefik to my cluster and have service working for it:

```bash
traefik                                      ClusterIP      10.96.231.57   <none>                     8000/TCP,8080/TCP,4443/TCP,27017/TCP        32h
my-hetzner-loadbalancer   LoadBalancer   10.96.57.135   10.98.0.2,<hide external lb ip>   80:30862/TCP,8080:32150/TCP,443:32425/TCP   34h
whoami                                       ClusterIP      10.96.117.38   <none>                     80/TCP                                      24h
```

I cant get Loadbalancer work longer than durring "healthcheck". I I go to port 8080 as soon i start changes on my loadbalancer i get webpages and websocket to traefik dashboard is connected. It holds connection aslong as i let browser tab  open. I can also reach "whoami" container with HTTPS.

But after healthcheck is done it goes red on web page with status unhealthy. And after that i cant connect any of the services.

Can someone help we with that?

Same behaviour i have on other accounts and loadbalancers.

Here my output.

Here my description for LB Service:

```yaml
apiVersion: v1
kind: Service
metadata:
  name: my-hetzner-loadbalancer
  labels:
    app.kubernetes.io/name: hetzner-loadbalancer
    app.kubernetes.io/instance: my-hetzner
  annotations:
    # https://pkg.go.dev/github.com/hetznercloud/hcloud-cloud-controller-manager/internal/annotation?tab=doc
    load-balancer.hetzner.cloud/name: <my-hetzner-loadbalancer-name>
    load-balancer.hetzner.cloud/location: nbg1
    load-balancer.hetzner.cloud/type: "lb11"
    load-balancer.hetzner.cloud/use-private-ip: "true"
    load-balancer.hetzner.cloud/uses-proxyprotocol: "true"
spec:
  externalTrafficPolicy: Cluster
  selector:
    app.kubernetes.io/instance: traefik
    app.kubernetes.io/name: traefik
  ports:
    - name: http
      port: 80
      protocol: TCP
      targetPort: 8000
    - name: traefik
      port: 8080
      protocol: TCP
      targetPort: 8080
    - name: https
      port: 443
      protocol: TCP
      targetPort: 4443
  type: LoadBalancer
  externalTrafficPolicy: "Local"
```

**Comment by LKaemmerling** [comment]
It looks like the LB can not reach the Services. Could you give me an LB ID? I can then check everything on our side. Do you 

The only thing i notice is that you have `externalTrafficPolicy` twice, once with `Cluster` and one with `Local`.

**Comment by nazarkulyk** [comment]
@LKaemmerling thanks.
Balancer ID is: 79766 Please check it. I can reproduce it, services are reachable till healthcheck over LB, but not afterthat.

**Comment by nazarkulyk** [comment]
I have also Technical Issue open for that on Hetzner.
Ticket#2020090703009009

But answer i got is not really proper for kubernetes... Maybe you @LKaemmerling kann interact with this ticket.

**Comment by LKaemmerling** [comment]
Hey @nazarkulyk could you try to set the `"load-balancer.hetzner.cloud/health-check-port"` to the correct (node) port?

**Comment by nazarkulyk** [comment]
@LKaemmerling hey, thanks, but what would be a nodePort ? I have only Service Cluster Ports ? No port on nodes self.

**Comment by LKaemmerling** [comment]
> @LKaemmerling hey, thanks, but what would be a nodePort ? I have only Service Cluster Ports ? No port on nodes self.

We currently try to understand your setup. What we understand so far:
- You want to have one LB that opens the Ports 443, 80 and 8080
- They all go to traefik which then itself will perform the requests to the correct pods?
- The whole traffic goes over Networks?
- The Health Check goes to the service ports you opened (So to traefik)?
- Proxy Protocol is supported on all Application/Traefik parts (as you specified proxy-protocol: true)

Could you please share the current service configuration (and then don't change something, as I'm looking into it; you can redact the IP of course)? 
```
kubectl describe svc/<your-lb-service>
```

**Comment by nazarkulyk** [comment]
```bash
kubectl -n ufu-system get svc traefik                                                                                                                                         09:45:55
NAME      TYPE        CLUSTER-IP     EXTERNAL-IP   PORT(S)                                AGE
traefik   ClusterIP   10.96.92.179   <none>        8000/TCP,8080/TCP,4443/TCP,27017/TCP   23h
```

My answers:

- LB get incomming Ports like 443, 80, 8080 and 27017 (mongodb), mysql and so on
- Traefik do routing inside k8s cluster based on ingressroutes and tcp servicesto correct pods and do loadbalancing
- whole traffic should be done over internal k8s network whick is based on hcloud-cloud-controller-manager and internal heztner network setup with hcloud network create
- How can i tell LB to do proper healthcheck if traefik is not open on NodePorts ? Only ClusterIP ports!
- Proxy protocol is supported (aslong as LB do health check i can reach my whoiam pod, which provides me X-Forwared-For HEADER with proper IP outside Hetzner to get client IP)

```bash
ubectl -n ufu-system describe svc/my-hetzner-loadbalancer-79766                                                                                                 09:51:16
Name:                     my-hetzner-loadbalancer-79766
Namespace:                my-system
Labels:                   app.kubernetes.io/instance=my-system
                          app.kubernetes.io/managed-by=Helm
                          app.kubernetes.io/name=hetzner-loadbalancer
Annotations:              load-balancer.hetzner.cloud/health-check-port: 8000
                          load-balancer.hetzner.cloud/location: nbg1
                          load-balancer.hetzner.cloud/name: <proper-name-of-balancer>
                          load-balancer.hetzner.cloud/type: lb11
                          load-balancer.hetzner.cloud/use-private-ip: true
                          load-balancer.hetzner.cloud/uses-proxyprotocol: true
                          meta.helm.sh/release-name: my-system
                          meta.helm.sh/release-namespace: my-system
Selector:                 app.kubernetes.io/instance=traefik,app.kubernetes.io/name=traefik
Type:                     LoadBalancer
IP:                       10.96.57.135
LoadBalancer Ingress:     <properIPv4externalIP>, 10.98.0.2
Port:                     http  80/TCP
TargetPort:               8000/TCP
NodePort:                 http  30862/TCP
Endpoints:                10.244.1.71:8000
Port:                     traefik  8080/TCP
TargetPort:               8080/TCP
NodePort:                 traefik  32150/TCP
Endpoints:                10.244.1.71:8080
Port:                     https  443/TCP
TargetPort:               4443/TCP
NodePort:                 https  32425/TCP
Endpoints:                10.244.1.71:4443
Session Affinity:         None
External Traffic Policy:  Local
HealthCheck NodePort:     32615
Events:
  Type    Reason                Age                    From                Message
  ----    ------                ----                   ----                -------
  Normal  EnsuringLoadBalancer  6m25s (x17 over 2d9h)  service-controller  Ensuring load balancer
  Normal  EnsuredLoadBalancer   6m16s (x17 over 2d9h)  service-controller  Ensured load balancer
```

I just hide my proper external IP, but you know it. 10.244.x.x is pod cidr on k8s and properly routed my hetzner network.
I changed some names, i dont wont make it public.
If you want i can send you per E-Mail whole data.
I also send you E-Mail yesterday with screenshot to show how i am connected during port HealthCheck and it holds open connection whole day, but dont work for new connections.

**Comment by LKaemmerling** [comment]
Could you try changing the Traffic Policy to `Cluster` (and remove the `load-balancer.hetzner.cloud/health-check-port` annotation again)? It looks like the LB is not able to connect to the correct ports on the nodes.

**Comment by nazarkulyk** [comment]
@LKaemmerling i did changed it.
```bash
kubectl -n ufu-system describe svc/my-hetzner-loadbalancer-79766                                                                                                 10:50:36
Name:                     my-hetzner-loadbalancer-79766
Namespace:                my-system
Labels:                   app.kubernetes.io/instance=my-system
                          app.kubernetes.io/managed-by=Helm
                          app.kubernetes.io/name=hetzner-loadbalancer
Annotations:              load-balancer.hetzner.cloud/location: nbg1
                          load-balancer.hetzner.cloud/name: <proper-name-of-balancer>
                          load-balancer.hetzner.cloud/type: lb11
                          load-balancer.hetzner.cloud/use-private-ip: true
                          load-balancer.hetzner.cloud/uses-proxyprotocol: true
                          meta.helm.sh/release-name: my-system
                          meta.helm.sh/release-namespace: my-system
Selector:                 app.kubernetes.io/instance=traefik,app.kubernetes.io/name=traefik
Type:                     LoadBalancer
IP:                       10.96.57.135
LoadBalancer Ingress:     <properIPv4externalIP>, 10.98.0.2
Port:                     http  80/TCP
TargetPort:               8000/TCP
NodePort:                 http  30862/TCP
Endpoints:                10.244.1.71:8000
Port:                     traefik  8080/TCP
TargetPort:               8080/TCP
NodePort:                 traefik  32150/TCP
Endpoints:                10.244.1.71:8080
Port:                     https  443/TCP
TargetPort:               4443/TCP
NodePort:                 https  32425/TCP
Endpoints:                10.244.1.71:4443
Session Affinity:         None
External Traffic Policy:  Cluster
Events:
  Type    Reason                Age                   From                Message
  ----    ------                ----                  ----                -------
  Normal  EnsuringLoadBalancer  17s (x18 over 2d10h)  service-controller  Ensuring load balancer
  Normal  EnsuredLoadBalancer   14s (x18 over 2d10h)  service-controller  Ensured load balancer
```

Same behavior...

**Comment by nazarkulyk** [comment]
It worked better in first LB beta times. Now its kind hard to get it working.

**Comment by LKaemmerling** [comment]
Could you disable the proxy protocol? Actually it is quite complicated to debug this from the outside.

**Comment by nazarkulyk** [comment]
@LKaemmerling we can switch to some more comfortable chat system maybe ?
I can give you also access if you want... There is currently nothing. I am pretty at start building an Cluster.
I did disabled Proxy

**Comment by LKaemmerling** [comment]
Would it be possible that you join https://whereby.com/hcloud-integrations ? (Whereby is something like zoom, but we can use it without cam)

**Comment by nazarkulyk** [comment]
@LKaemmerling  i have new findings...
as soon i iterate my external LB port i get everything work...

Somehow LB keeps old port. I can use tham even after i removed port from kubernetes annotation and its not showed on hetzner webpage and not in hcloud description for LB

**Comment by nazarkulyk** [comment]
There is an bug on LB side

**Comment by LKaemmerling** [comment]
As i said in the call, the port is just missing in the response of the CLI, if you have a look at the response from the API the port is visible within the health check :)

**Comment by nazarkulyk** [comment]
@LKaemmerling what i found out. if i use new port each time i change config - port works as expected even with default healthcheck (i didn nothing set up on trafik side).
Othercase i do remove all services throw WebPage on LB. Thank update config throw yaml and controller-manager and it works well to.

So i am consisting - there is for sure some bug there. Let see if someone else get it too.

Sometimes it helps to restart controller-manager port to get updates hapend, specialy for internal nodeport calculations.

My configuration is currently on ClusterIP Service based setup. So no open ports on nodes self.

**Comment by tobiaskohlbau** [comment]
Hello,

I'm pretty sure I'm hitting the same issue. I've had similar experiences that health checks for load balancers are not working after changes to the LB by _hcloud-cloud-controller-manager_ through a underlying service change.

I digged into the issue and think I found the underlying issue.

_hcloud-controller-cloud-manager_ updates the LB and it's corresponding target ports after a change to the underlying service (nodePort). The LB itself does not reflect these changes. As its health checks still hit the old port instead of the new one. It's notable that the hcloud UI shows the new ports so by the looks of it the changes are applied to the hcloud system but not to the running LB or it's health check.

**Service spec**
```YAML
spec:
  clusterIP: 10.129.208.219
  externalTrafficPolicy: Cluster
  ports:
  - name: status-port
    nodePort: 30327
    port: 15021
    protocol: TCP
    targetPort: 15021
  - name: http2
    nodePort: 31998
    port: 80
    protocol: TCP
    targetPort: 8080
  - name: https
    nodePort: 31285
    port: 443
    protocol: TCP
    targetPort: 8443
  - name: tls
    nodePort: 31259
    port: 15443
    protocol: TCP
    targetPort: 15443
  selector:
    app: istio-ingressgateway
    istio: ingressgateway
  sessionAffinity: None
  type: LoadBalancer
```

** tcpdump for new port**
```SHELL
root@node2:~# tcpdump -i enp7s0 port 30327
tcpdump: verbose output suppressed, use -v or -vv for full protocol decode
listening on enp7s0, link-type EN10MB (Ethernet), capture size 262144 bytes
```

** tcpdump for old port**
```SHELL
root@node2:~# tcpdump -i enp7s0 port 30892
tcpdump: verbose output suppressed, use -v or -vv for full protocol decode
listening on enp7s0, link-type EN10MB (Ethernet), capture size 262144 bytes
10:51:31.906206 IP 10.128.0.4.1026 > node2.30892: Flags [S], seq 201530462, win 64860, options [mss 1410,sackOK,TS val 2883041862 ecr 0,nop,wscale 7], length 0
10:51:31.906302 IP node2.30892 > 10.128.0.4.1026: Flags [R.], seq 0, ack 201530463, win 0, length 0
10:51:46.908267 IP 10.128.0.4.4074 > node2.30892: Flags [S], seq 1170637002, win 64860, options [mss 1410,sackOK,TS val 2883056864 ecr 0,nop,wscale 7], length 0
10:51:46.908348 IP node2.30892 > 10.128.0.4.4074: Flags [R.], seq 0, ack 1170637003, win 0, length 0
10:52:01.910231 IP 10.128.0.4.7316 > node2.30892: Flags [S], seq 3985335659, win 64860, options [mss 1410,sackOK,TS val 2883071866 ecr 0,nop,wscale 7], length 0
10:52:01.910291 IP node2.30892 > 10.128.0.4.7316: Flags [R.], seq 0, ack 3985335660, win 0, length 0
```

I've changed _hcloud-cloud-controller-manager_ to delete the services and recreate them instead of updating the existing service.  After applying that change everything works as expected and the LB switches to the new target.

```Go
                if portExists {
			klog.InfoS("update service", "op", op, "port", portNo, "loadBalancerID", lb.ID)

			action, _, err = l.LBClient.DeleteService(ctx, lb, portNo)
			if err != nil {
				return changed, fmt.Errorf("%s: %w", op, err)
			}

			if err = WatchAction(ctx, l.ActionClient, action); err != nil {
				return changed, fmt.Errorf("%s: %w", op, err)
			}

			addOpts, err = b.buildAddServiceOpts()
			if err != nil {
				return changed, fmt.Errorf("%s: %w", op, err)
			}

			action, _, err = l.LBClient.AddService(ctx, lb, addOpts)
			if err != nil {
				return changed, fmt.Errorf("%s: %w", op, err)
			}
		}
```

# Solution
IMO there are two possible options:

- This is an documentation issue and updating the target port of a LB service is not supported and therefore the controller should handle updates in the way: delete->create.
- This is an issue within the LB implementation itself which does not pickup the changes although the changes are reflected within the internal hcloud system so that UI and API show the reflection.

**Comment by tobiaskohlbau** [comment]
I've created a new project and created a test setup, in order to check that this is nothing which is related to the kubernetes, docker or my network setup.

I used a single vm with default ubuntu-20.04 image, a load balancer and a internal network.

In the first step I configured a LB to point to port 8080 on the vm via tcp protocol. After the health check picked up the working vm I checked that the traffic is working via sending a request to public ip of vm and lb.

Following this I changed the vm to listen on port 8081 and used the api endpoint to change the _destination_port_ of LB to 8081. 
This resulted in the same observation as stated above: LB still hits the old port for health check.

**Comment by LKaemmerling** [comment]
Hey @tobiaskohlbau could you please try to use the annotation? 
```
load-balancer.hetzner.cloud/health-check-port
```
https://github.com/hetznercloud/hcloud-cloud-controller-manager/issues/87#issuecomment-689357973

Both @fhofherr  and i are this week on vacation, we will look into it next week.

**Comment by tobiaskohlbau** [comment]
@LKaemmerling thanks for answering in your vacation. Please take your time this is not production relevant.

I need to revise my statement from https://github.com/hetznercloud/hcloud-cloud-controller-manager/issues/87#issuecomment-691944778 as this is only reproducible if the API is used in a non documented way. The field _health_check_ is declared as required within the API but the API accepts requests which do not contain this field. This is from my momentally standpoint the underlying issue why the controller is misbehaving. If the annotiation _load-balancer.hetzner.cloud/health-check-port_ is not set the field _health_check_ is not added to the request upon creation. Therefore the API fills in a tcp health check to selected destination port. Upon changing the nodePort (kubernetes service/deployment) the update request to the API does not contain the field _health_check_. But in contrast to creation the API server does not fill the missing _health_check_ field with a default tcp health check and therefore the already existing health check is not touched.

If this behavior of filling a default health check to destination port is intended the field _health_check_ should be made optional and the default health check documented. In advance this could been made persistent between creation and updating or it is optional upon creation but mandatory on updates.

In either way I think it's a good idea to be explicit and set this default behavior in the controller itself if annotation _load-balancer.hetzner.cloud/health-check-port_ is not present.

**Comment by tobiaskohlbau** [comment]
I've created a possible fix here https://github.com/hetznercloud/hcloud-cloud-controller-manager/compare/hetznercloud:f1b3d01...tobiaskohlbau:c235768. If this gets accepted as a viable solution I will happily upstream that CL.
